<?xml version="1.0" encoding="UTF-8"?>
<xs:schema xmlns:xs="http://www.w3.org/2001/XMLSchema">
    <xs:element name="queries">
        <xs:complexType>
            <xs:sequence>
                <xs:element name="query" maxOccurs="unbounded">
                    <xs:complexType>
                        <xs:sequence>
                            <xs:element name="description" type="xs:string" />
                            <xs:element name="author" type="xs:string" />
                            <xs:element name="date" type="xs:string" />
                            <xs:element name="tags">
                                <xs:complexType>
                                    <xs:sequence>
                                        <xs:element name="tag" maxOccurs="unbounded"
                                            type="xs:string" />
                                    </xs:sequence>
                                </xs:complexType>
                            </xs:element>
                            <xs:element name="answers">
                                <xs:complexType>
                                    <xs:sequence>
                                        <xs:element name="answer" maxOccurs="unbounded">
                                            <xs:complexType>
                                                <xs:sequence>
                                                    <xs:element name="description" type="xs:string" />
                                                    <xs:element name="author" type="xs:string" />
                                                    <xs:element name="date" type="xs:string" />
                                                </xs:sequence>
                                            </xs:complexType>
                                        </xs:element>
                                    </xs:sequence>
                                </xs:complexType>
                            </xs:element>
                        </xs:sequence>
                    </xs:complexType>
                </xs:element>
            </xs:sequence>
        </xs:complexType>
    </xs:element>
</xs:schema>